/:  Bus 02.Port 1: Dev 1, Class=root_hub, Driver=xhci_hcd/4p, 5000M
    |__ Port 2: Dev 2, If 0, Class=Hub, Driver=hub/4p, 5000M
        |__ Port 1: Dev 3, If 0, Class=Hub, Driver=hub/4p, 5000M
        |__ Port 4: Dev 4, If 0, Class=Mass Storage, Driver=uas, 5000M
/:  Bus 01.Port 1: Dev 1, Class=root_hub, Driver=xhci_hcd/1p, 480M
    |__ Port 1: Dev 2, If 0, Class=Hub, Driver=hub/4p, 480M
        |__ Port 2: Dev 3, If 0, Class=Hub, Driver=hub/4p, 480M
            |__ Port 3: Dev 23, If 2, Class=Human Interface Device, Driver=usbhid, 12M
            |__ Port 3: Dev 23, If 0, Class=Human Interface Device, Driver=usbhid, 12M
            |__ Port 3: Dev 23, If 1, Class=Human Interface Device, Driver=usbhid, 12M
            |__ Port 1: Dev 5, If 0, Class=Hub, Driver=hub/4p, 480M
                |__ Port 4: Dev 18, If 1, Class=Human Interface Device, Driver=usbhid, 12M
                |__ Port 4: Dev 18, If 2, Class=Human Interface Device, Driver=usbhid, 12M
                |__ Port 4: Dev 18, If 0, Class=Human Interface Device, Driver=usbhid, 12M
                |__ Port 2: Dev 8, If 2, Class=CDC Data, Driver=cdc_acm, 12M
                |__ Port 2: Dev 8, If 0, Class=Human Interface Device, Driver=usbhid, 12M
                |__ Port 2: Dev 8, If 1, Class=Communications, Driver=cdc_acm, 12M
                |__ Port 3: Dev 10, If 2, Class=CDC Data, Driver=cdc_acm, 480M
                |__ Port 3: Dev 10, If 0, Class=Human Interface Device, Driver=usbhid, 480M
                |__ Port 3: Dev 10, If 1, Class=Communications, Driver=cdc_acm, 480M
                |__ Port 1: Dev 15, If 0, Class=Hub, Driver=hub/4p, 480M
                    |__ Port 4: Dev 17, If 0, Class=, Driver=, 12M
                    |__ Port 1: Dev 16, If 0, Class=Human Interface Device, Driver=usbhid, 12M
        |__ Port 3: Dev 4, If 0, Class=Human Interface Device, Driver=usbhid, 1.5M
        |__ Port 3: Dev 4, If 1, Class=Human Interface Device, Driver=usbhid, 1.5M
        |__ Port 4: Dev 6, If 0, Class=Human Interface Device, Driver=usbhid, 1.5M

Bus 001 Device 023: ID 1ea7:0907 SHARKOON Technologies GmbH 
Device Descriptor:
  bLength                18
  bDescriptorType         1
  bcdUSB               1.10
  bDeviceClass            0 
  bDeviceSubClass         0 
  bDeviceProtocol         0 
  bMaxPacketSize0        64
  idVendor           0x1ea7 SHARKOON Technologies GmbH
  idProduct          0x0907 
  bcdDevice            3.00
  iManufacturer           1 SEMITEK
  iProduct                2 USB-HID Gaming Keyboard
  iSerial                 3 SN0000000001
  bNumConfigurations      1
  Configuration Descriptor:
    bLength                 9
    bDescriptorType         2
    wTotalLength       0x005b
    bNumInterfaces          3
    bConfigurationValue     1
    iConfiguration          0 
    bmAttributes         0xa0
      (Bus Powered)
      Remote Wakeup
    MaxPower              100mA
    Interface Descriptor:
      bLength                 9
      bDescriptorType         4
      bInterfaceNumber        0
      bAlternateSetting       0
      bNumEndpoints           1
      bInterfaceClass         3 Human Interface Device
      bInterfaceSubClass      1 Boot Interface Subclass
      bInterfaceProtocol      1 Keyboard
      iInterface              0 
        HID Device Descriptor:
          bLength                 9
          bDescriptorType        33
          bcdHID               1.11
          bCountryCode            0 Not supported
          bNumDescriptors         1
          bDescriptorType        34 Report
          wDescriptorLength      64
         Report Descriptors: 
           ** UNAVAILABLE **
      Endpoint Descriptor:
        bLength                 7
        bDescriptorType         5
        bEndpointAddress     0x81  EP 1 IN
        bmAttributes            3
          Transfer Type            Interrupt
          Synch Type               None
          Usage Type               Data
        wMaxPacketSize     0x0008  1x 8 bytes
        bInterval               1
    Interface Descriptor:
      bLength                 9
      bDescriptorType         4
      bInterfaceNumber        1
      bAlternateSetting       0
      bNumEndpoints           2
      bInterfaceClass         3 Human Interface Device
      bInterfaceSubClass      0 
      bInterfaceProtocol      0 
      iInterface              0 
        HID Device Descriptor:
          bLength                 9
          bDescriptorType        33
          bcdHID               1.11
          bCountryCode            0 Not supported
          bNumDescriptors         1
          bDescriptorType        34 Report
          wDescriptorLength      34
         Report Descriptors: 
           ** UNAVAILABLE **
      Endpoint Descriptor:
        bLength                 7
        bDescriptorType         5
        bEndpointAddress     0x83  EP 3 IN
        bmAttributes            3
          Transfer Type            Interrupt
          Synch Type               None
          Usage Type               Data
        wMaxPacketSize     0x0040  1x 64 bytes
        bInterval               1
      Endpoint Descriptor:
        bLength                 7
        bDescriptorType         5
        bEndpointAddress     0x04  EP 4 OUT
        bmAttributes            3
          Transfer Type            Interrupt
          Synch Type               None
          Usage Type               Data
        wMaxPacketSize     0x0040  1x 64 bytes
        bInterval               1
    Interface Descriptor:
      bLength                 9
      bDescriptorType         4
      bInterfaceNumber        2
      bAlternateSetting       0
      bNumEndpoints           1
      bInterfaceClass         3 Human Interface Device
      bInterfaceSubClass      0 
      bInterfaceProtocol      0 
      iInterface              0 
        HID Device Descriptor:
          bLength                 9
          bDescriptorType        33
          bcdHID               1.11
          bCountryCode            0 Not supported
          bNumDescriptors         1
          bDescriptorType        34 Report
          wDescriptorLength     203
         Report Descriptors: 
           ** UNAVAILABLE **
      Endpoint Descriptor:
        bLength                 7
        bDescriptorType         5
        bEndpointAddress     0x82  EP 2 IN
        bmAttributes            3
          Transfer Type            Interrupt
          Synch Type               None
          Usage Type               Data
        wMaxPacketSize     0x0040  1x 64 bytes
        bInterval               1
Device Status:     0x0000
  (Bus Powered)
