/:  Bus 06.Port 1: Dev 1, Class=root_hub, Driver=xhci_hcd/4p, 5000M
    |__ Port 1: Dev 2, If 0, Class=Hub, Driver=hub/4p, 5000M
/:  Bus 05.Port 1: Dev 1, Class=root_hub, Driver=xhci_hcd/4p, 480M
    |__ Port 1: Dev 2, If 0, Class=Hub, Driver=hub/4p, 480M
        |__ Port 1: Dev 4, If 0, Class=Communications, Driver=cdc_acm, 12M
        |__ Port 1: Dev 4, If 1, Class=CDC Data, Driver=cdc_acm, 12M
        |__ Port 2: Dev 5, If 1, Class=CDC Data, Driver=cdc_acm, 12M
        |__ Port 2: Dev 5, If 2, Class=Human Interface Device, Driver=usbhid, 12M
        |__ Port 2: Dev 5, If 0, Class=Communications, Driver=cdc_acm, 12M
    |__ Port 4: Dev 3, If 0, Class=Human Interface Device, Driver=usbhid, 1.5M
/:  Bus 04.Port 1: Dev 1, Class=root_hub, Driver=xhci_hcd/4p, 5000M
/:  Bus 03.Port 1: Dev 1, Class=root_hub, Driver=xhci_hcd/4p, 480M
    |__ Port 4: Dev 2, If 0, Class=Human Interface Device, Driver=usbhid, 1.5M
    |__ Port 4: Dev 2, If 1, Class=Human Interface Device, Driver=usbhid, 1.5M
/:  Bus 02.Port 1: Dev 1, Class=root_hub, Driver=xhci_hcd/8p, 10000M
    |__ Port 4: Dev 2, If 0, Class=Hub, Driver=hub/4p, 5000M
        |__ Port 1: Dev 3, If 0, Class=Hub, Driver=hub/4p, 5000M
/:  Bus 01.Port 1: Dev 1, Class=root_hub, Driver=xhci_hcd/14p, 480M
    |__ Port 2: Dev 2, If 2, Class=Audio, Driver=snd-usb-audio, 12M
    |__ Port 2: Dev 2, If 0, Class=Audio, Driver=snd-usb-audio, 12M
    |__ Port 2: Dev 2, If 3, Class=Human Interface Device, Driver=usbhid, 12M
    |__ Port 2: Dev 2, If 1, Class=Audio, Driver=snd-usb-audio, 12M
    |__ Port 3: Dev 10, If 2, Class=Human Interface Device, Driver=usbhid, 12M
    |__ Port 3: Dev 10, If 0, Class=Human Interface Device, Driver=usbhid, 12M
    |__ Port 3: Dev 10, If 1, Class=Human Interface Device, Driver=usbhid, 12M
    |__ Port 4: Dev 3, If 0, Class=Hub, Driver=hub/4p, 480M
        |__ Port 1: Dev 5, If 0, Class=Hub, Driver=hub/4p, 480M
            |__ Port 3: Dev 8, If 0, Class=Vendor Specific Class, Driver=, 480M
        |__ Port 4: Dev 7, If 0, Class=Human Interface Device, Driver=usbhid, 12M
        |__ Port 4: Dev 7, If 1, Class=Human Interface Device, Driver=usbhid, 12M
    |__ Port 7: Dev 4, If 0, Class=Wireless, Driver=btusb, 12M
    |__ Port 7: Dev 4, If 1, Class=Wireless, Driver=btusb, 12M
    |__ Port 8: Dev 6, If 0, Class=Human Interface Device, Driver=usbhid, 12M

Bus 001 Device 010: ID 04d9:a06b Holtek Semiconductor, Inc. 
Device Descriptor:
  bLength                18
  bDescriptorType         1
  bcdUSB               2.00
  bDeviceClass            0 (Defined at Interface level)
  bDeviceSubClass         0 
  bDeviceProtocol         0 
  bMaxPacketSize0         8
  idVendor           0x04d9 Holtek Semiconductor, Inc.
  idProduct          0xa06b 
  bcdDevice            3.02
  iManufacturer           1 E-Signal
  iProduct                2 GIGABYTE Keyboard
  iSerial                 0 
  bNumConfigurations      1
  Configuration Descriptor:
    bLength                 9
    bDescriptorType         2
    wTotalLength           84
    bNumInterfaces          3
    bConfigurationValue     1
    iConfiguration          0 
    bmAttributes         0xa0
      (Bus Powered)
      Remote Wakeup
    MaxPower              100mA
    Interface Descriptor:
      bLength                 9
      bDescriptorType         4
      bInterfaceNumber        0
      bAlternateSetting       0
      bNumEndpoints           1
      bInterfaceClass         3 Human Interface Device
      bInterfaceSubClass      1 Boot Interface Subclass
      bInterfaceProtocol      1 Keyboard
      iInterface              0 
        HID Device Descriptor:
          bLength                 9
          bDescriptorType        33
          bcdHID               1.10
          bCountryCode            0 Not supported
          bNumDescriptors         1
          bDescriptorType        34 Report
          wDescriptorLength      59
         Report Descriptors: 
           ** UNAVAILABLE **
      Endpoint Descriptor:
        bLength                 7
        bDescriptorType         5
        bEndpointAddress     0x81  EP 1 IN
        bmAttributes            3
          Transfer Type            Interrupt
          Synch Type               None
          Usage Type               Data
        wMaxPacketSize     0x0008  1x 8 bytes
        bInterval               8
    Interface Descriptor:
      bLength                 9
      bDescriptorType         4
      bInterfaceNumber        1
      bAlternateSetting       0
      bNumEndpoints           1
      bInterfaceClass         3 Human Interface Device
      bInterfaceSubClass      0 No Subclass
      bInterfaceProtocol      0 None
      iInterface              0 
        HID Device Descriptor:
          bLength                 9
          bDescriptorType        33
          bcdHID               1.10
          bCountryCode            0 Not supported
          bNumDescriptors         1
          bDescriptorType        34 Report
          wDescriptorLength      81
         Report Descriptors: 
           ** UNAVAILABLE **
      Endpoint Descriptor:
        bLength                 7
        bDescriptorType         5
        bEndpointAddress     0x82  EP 2 IN
        bmAttributes            3
          Transfer Type            Interrupt
          Synch Type               None
          Usage Type               Data
        wMaxPacketSize     0x0010  1x 16 bytes
        bInterval               8
    Interface Descriptor:
      bLength                 9
      bDescriptorType         4
      bInterfaceNumber        2
      bAlternateSetting       0
      bNumEndpoints           1
      bInterfaceClass         3 Human Interface Device
      bInterfaceSubClass      0 No Subclass
      bInterfaceProtocol      0 None
      iInterface              0 
        HID Device Descriptor:
          bLength                 9
          bDescriptorType        33
          bcdHID               1.10
          bCountryCode            0 Not supported
          bNumDescriptors         1
          bDescriptorType        34 Report
          wDescriptorLength      37
         Report Descriptors: 
           ** UNAVAILABLE **
      Endpoint Descriptor:
        bLength                 7
        bDescriptorType         5
        bEndpointAddress     0x83  EP 3 IN
        bmAttributes            3
          Transfer Type            Interrupt
          Synch Type               None
          Usage Type               Data
        wMaxPacketSize     0x0010  1x 16 bytes
        bInterval               1
Device Status:     0x0000
  (Bus Powered)
